stream,title,description,special_requests,recommended sources,book_id,scheduled_date,isbn,imprint,publisher,format,priority,notes
Interplanetary Ambition,Martian Self-Reliance: Isolation versus Earth Support,"Search for quotes on establishing a self-reliant Mars colony, exploring isolationist strategies (e.g., local resource production, independent governance) versus reliance on Earth (e.g., supply missions, expertise). Include space exploration plans, astrobiology papers, and sci-fi on colony resilience.",,,,9/2/25,,xynapse_traces,Nimble Books LLC,paperback,,
Neural Augmentation,Mind-Machine Fusion: Liberation versus Dependency,"Seek quotes on brain-computer interfaces, weighing cognitive liberation (e.g., enhanced learning, disability mitigation) against dependency risks (e.g., tech reliance, privacy loss). Prioritize neurotechnology studies, expert presentations, and sci-fi on human augmentation.",,,,9/9/25,,xynapse_traces,Nimble Books LLC,paperback,,
Sustainable Energy,Global Renewables: Scale versus Scarcity,"Find quotes about the global expansion of renewable energy, focusing on the tension between scaling solar and wind globally versus resource scarcity and other scaling challenges. ",,,,9/16/25,,xynapse_traces,Nimble Books LLC,paperback,,
Global Connectivity,Internet for All: Inclusion versus Barriers,"Collect quotes on global internet access missions, emphasizing inclusive access (e.g., underserved regions, affordability) versus barriers (e.g., cost, infrastructure). Include telecom research, project updates, and fiction on digital equity.",,,,9/23/25,,xynapse_traces,Nimble Books LLC,paperback,,
Urban Infrastructure,Subterranean Cities: Efficiency versus Feasibility,"Search for quotes on underground urban solutions, weighing efficiency (e.g., reduced congestion, space optimization) against feasibility challenges (e.g., construction costs, safety). Prioritize urban engineering studies, tunneling plans, and fiction on future cities.",,,,9/30/25,,xynapse_traces,Nimble Books LLC,paperback,,
Artificial Intelligence,AI-Driven Science: Speed versus Safety,"Seek quotes on AI’s acceleration of scientific discovery, exploring rapid advancements (e.g., physics breakthroughs, medical research) versus safety concerns (e.g., ethical risks, errors). Include AI research papers, mission statements, and sci-fi on AI science.",,,,10/7/25,,xynapse_traces,Nimble Books LLC,paperback,,
Government Efficiency,Streamlined Governance: Agility versus Oversight,"Find quotes on AI-driven government reforms, weighing agile processes (e.g., automation, cost-cutting) against oversight needs (e.g., accountability, fairness). Focus on public administration research, reform proposals, and fiction on bureaucratic reform.",,,,10/14/25,,xynapse_traces,Nimble Books LLC,paperback,,
Collective Knowledge,Free Speech Platforms: Openness versus Regulation,"Collect quotes on free speech platforms, exploring open discourse (e.g., diverse perspectives, truth-seeking) versus regulatory needs (e.g., combating misinformation). Prioritize communication studies, platform posts, and fiction on digital freedom.",,,,10/21/25,,xynapse_traces,Nimble Books LLC,paperback,,
Pronatal Innovation,Birth Rate Boost: Policy versus Freedom,"Search for quotes on AI-driven pronatal strategies, focusing on policy incentives (e.g., subsidies, healthcare) versus individual freedom (e.g., personal choice, privacy). Include demographic studies, pronatal comments, and fiction on population growth.",,,,10/28/25,,xynapse_traces,Nimble Books LLC,paperback,,
Resilience and Vision,Visionary Drive: Passion versus Peril,"Seek quotes on relentless ambition, exploring passionate innovation (e.g., groundbreaking ventures) versus personal perils (e.g., stress, isolation). Focus on psychology texts, leadership interviews, and fiction on visionary leadership.",,,,11/4/25,,xynapse_traces,Nimble Books LLC,paperback,,
Technological Disruption,Industry Shifts: Innovation versus Instability,"Find quotes on disruptive technologies (e.g., electric vehicles, space exploration), weighing innovative progress (e.g., new markets) against instability (e.g., economic disruption, job losses). Include innovation studies, expert comments, and fiction on tech upheaval.",,,,11/11/25,,xynapse_traces,Nimble Books LLC,paperback,,
Space Economy,Martian Commerce: Local versus Interplanetary,"Collect quotes on building Martian markets, exploring local economies (e.g., resource-based trade) versus interplanetary commerce (e.g., Earth-Mars trade routes). Prioritize economic studies, space economic plans, and sci-fi on space trade.",,,,11/18/25,,xynapse_traces,Nimble Books LLC,paperback,,
Interplanetary Ambition,Mars Governance: Autonomy versus Oversight,"Search for quotes on governing Mars, focusing on autonomous systems (e.g., independent laws, local councils) versus Earth oversight (e.g., UN treaties, corporate influence). Include political science texts, governance views, and sci-fi on extraterrestrial politics.",,,,11/25/25,,xynapse_traces,Nimble Books LLC,paperback,,
Neural Augmentation,Cognitive Upgrades: Necessity versus Luxury,"Seek quotes on cognitive enhancements, exploring necessary applications (e.g., medical treatments) versus luxury upgrades (e.g., elective boosts). Prioritize neuroethics papers, expert talks, and sci-fi on brain enhancement ethics.",,,,12/2/25,,xynapse_traces,Nimble Books LLC,paperback,,
Sustainable Energy,Battery Revolution: Innovation versus Constraints,"Find quotes on battery technology, weighing revolutionary advancements (e.g., new chemistries, scalability) against constraints (e.g., supply chain, costs). Focus on materials science papers, battery announcements, and fiction on energy breakthroughs.",,,,12/9/25,,xynapse_traces,Nimble Books LLC,paperback,,
Global Connectivity,Satellite Networks: Durability versus Risks,"Collect quotes on satellite infrastructure, emphasizing durability (e.g., orbital resilience, redundancy) versus risks (e.g., collisions, cyberattacks). Include aerospace engineering studies, project updates, and sci-fi on satellite networks.",,,,12/16/25,,xynapse_traces,Nimble Books LLC,paperback,,
Urban Infrastructure,Tunnel Viability: Speed versus Stability,"Search for quotes on tunneling projects, focusing on speed benefits (e.g., rapid construction, transport) versus stability concerns (e.g., seismic risks, costs). Prioritize geotechnical research, tunneling goals, and fiction on urban infrastructure.",,,,12/23/25,,xynapse_traces,Nimble Books LLC,paperback,,
Artificial Intelligence,AI Precision: Accuracy versus Error,"Seek quotes on AI precision in scientific applications, exploring high accuracy (e.g., predictive models) versus error risks (e.g., data bias, miscalculations). Include machine learning papers, AI comments, and sci-fi on AI reliability.",,,,12/30/25,,xynapse_traces,Nimble Books LLC,paperback,,
Government Efficiency,Open Government: Transparency versus Security,"Find quotes on AI-driven government transparency, weighing open access (e.g., public data, accountability) against security needs (e.g., classified information). Focus on governance studies, transparency initiatives, and fiction on transparent rule.",,,,1/6/26,,xynapse_traces,Nimble Books LLC,paperback,,
Collective Knowledge,Knowledge Networks: Cohesion versus Division,"Collect quotes on knowledge-sharing platforms, exploring cohesive global networks (e.g., shared insights) versus divisive outcomes (e.g., polarized communities). Prioritize social media research, platform posts, and fiction on digital unity.",,,,1/13/26,,xynapse_traces,Nimble Books LLC,paperback,,
Pronatal Innovation,Fertility Optimization: Technology versus Nature,"Search for quotes on AI-driven fertility solutions, focusing on technological advancements (e.g., genetic screening, IVF) versus natural processes (e.g., traditional conception). Include reproductive health studies, pronatal views, and fiction on human reproduction.",,,,1/20/26,,xynapse_traces,Nimble Books LLC,paperback,,
Resilience and Vision,Bold Leadership: Inspiration versus Pressure,"Seek quotes on leadership approaches, exploring inspirational vision (e.g., motivating teams) versus high-pressure demands (e.g., intense workloads). Focus on leadership psychology, expert interviews, and fiction on transformative leaders.",,,,1/27/26,,xynapse_traces,Nimble Books LLC,paperback,,
Technological Disruption,Tech Adoption: Momentum versus Skepticism,"Find quotes on adopting new technologies (e.g., EVs, neural implants), weighing rapid momentum (e.g., consumer uptake) versus skepticism (e.g., safety concerns). Include technology diffusion studies, expert comments, and fiction on tech integration.",,,,2/3/26,,xynapse_traces,Nimble Books LLC,paperback,,
Space Economy,Space Markets: Innovation versus Control,"Collect quotes on developing space economies, focusing on innovative markets (e.g., space tourism, mining) versus regulatory control (e.g., international laws). Prioritize economic papers, space economic plans, and sci-fi on space commerce.",,,,2/10/26,,xynapse_traces,Nimble Books LLC,paperback,,
Interplanetary Ambition,Radiation Barriers: Protection versus Exposure,"Search for quotes on shielding Mars colonists from cosmic radiation, focusing on protective technologies (e.g., shielding materials, habitats) versus exposure risks (e.g., health impacts). Include space medicine papers, safety plans, and sci-fi on space survival.",,,,2/17/26,,xynapse_traces,Nimble Books LLC,paperback,,
Neural Augmentation,Implant Safety: Assurance versus Uncertainty,"Seek quotes on neural implant safety, exploring assurances (e.g., rigorous testing, biocompatibility) versus uncertainties (e.g., long-term effects). Prioritize medical device studies, safety comments, and sci-fi on neural tech risks.",,,,2/24/26,,xynapse_traces,Nimble Books LLC,paperback,,
Sustainable Energy,Solar Expansion: Dominance versus Balance,"Find quotes on solar energy expansion, weighing dominance (e.g., widespread adoption, cost declines) versus balanced energy mixes (e.g., wind, hydro). Focus on renewable energy studies, solar strategies, and eco-fiction on solar power.",,,,3/3/26,,xynapse_traces,Nimble Books LLC,paperback,,
Global Connectivity,Knowledge Access: Freedom versus Restriction,"Collect quotes on global knowledge access, exploring free access (e.g., open education) versus restrictions (e.g., government censorship). Include information policy studies, connectivity goals, and fiction on knowledge dissemination.",,,,3/10/26,,xynapse_traces,Nimble Books LLC,paperback,,
Urban Infrastructure,Underground Planning: Resilience versus Accessibility,"Search for quotes on underground urban designs, focusing on resilience (e.g., disaster-proofing) versus accessibility challenges (e.g., public access, costs). Prioritize urban planning research, infrastructure plans, and fiction on subterranean cities.",,,,3/17/26,,xynapse_traces,Nimble Books LLC,paperback,,
Artificial Intelligence,AI Governance: Freedom versus Constraint,"Seek quotes on AI development governance, exploring freedom for innovation (e.g., open research) versus constraints (e.g., ethical regulations). Include AI ethics papers, governance views, and sci-fi on AI oversight.",,,,3/24/26,,xynapse_traces,Nimble Books LLC,paperback,,
Government Efficiency,Policy Automation: Efficiency versus Equity,"Find quotes on AI-driven policy automation, weighing efficiency gains (e.g., streamlined decisions) against equity concerns (e.g., biased algorithms). Focus on policy analysis studies, automation comments, and fiction on automated governance.",,,,3/31/26,,xynapse_traces,Nimble Books LLC,paperback,,
Collective Knowledge,Truth Platforms: Objectivity versus Bias,"Collect quotes on truth-seeking platforms, exploring objective verification (e.g., AI fact-checking) versus human biases (e.g., subjective moderation). Prioritize information science studies, platform posts, and fiction on truth platforms.",,,,4/7/26,,xynapse_traces,Nimble Books LLC,paperback,,
Pronatal Innovation,Family Support: Data versus Intuition,"Search for quotes on AI-driven family planning support, focusing on data-driven tools (e.g., fertility tracking) versus intuitive approaches (e.g., cultural traditions). Include health tech studies, pronatal views, and fiction on family dynamics.",,,,4/14/26,,xynapse_traces,Nimble Books LLC,paperback,,
Resilience and Vision,Risk Endurance: Innovation versus Caution,"Seek quotes on risk-taking mindsets, exploring innovative leaps (e.g., bold ventures) versus cautious restraint (e.g., risk mitigation). Focus on entrepreneurship studies, expert interviews, and fiction on risk-driven leadership.",,,,4/21/26,,xynapse_traces,Nimble Books LLC,paperback,,
Technological Disruption,Market Evolution: Gradual versus Radical,"Find quotes on market transformations, weighing gradual evolution (e.g., incremental adoption) versus radical shifts (e.g., industry overhaul). Include business studies, expert comments, and fiction on market disruption.",,,,4/28/26,,xynapse_traces,Nimble Books LLC,paperback,,
Space Economy,Orbital Systems: Public versus Private,"Collect quotes on space infrastructure development, exploring private systems (e.g., commercial satellites) versus public investments (e.g., government stations). Prioritize aerospace economics, space plans, and sci-fi on orbital economies.",,,,5/5/26,,xynapse_traces,Nimble Books LLC,paperback,,
Interplanetary Ambition,Planetary Remaking: Feasibility versus Ethics,"Search for quotes on terraforming Mars, focusing on feasible engineering (e.g., atmospheric thickening) versus ethical concerns (e.g., ecological impacts). Include planetary science papers, terraforming comments, and sci-fi on planetary transformation.",,,,5/12/26,,xynapse_traces,Nimble Books LLC,paperback,,
Neural Augmentation,AI-Human Synergy: Collaboration versus Control,"Seek quotes on human-AI integration, exploring collaborative synergy (e.g., enhanced cognition) versus control risks (e.g., AI dominance). Prioritize AI integration studies, expert vision, and sci-fi on human-AI dynamics.",,,,5/19/26,,xynapse_traces,Nimble Books LLC,paperback,,
Sustainable Energy,Energy Access: Equity versus Exclusion,"Find quotes on energy solutions, focusing on equitable access (e.g., affordable renewables) versus exclusionary barriers (e.g., high costs). Focus on energy justice studies, sustainability goals, and eco-fiction on energy equity.",,,,5/26/26,,xynapse_traces,Nimble Books LLC,paperback,,
Global Connectivity,Digital Gaps: Closing versus Widening,"Collect quotes on efforts to close digital divides, exploring connectivity gains (e.g., rural access) versus risks of widening gaps (e.g., cost barriers). Include digital divide research, connectivity plans, and fiction on connectivity challenges.",,,,6/2/26,,xynapse_traces,Nimble Books LLC,paperback,,
Urban Infrastructure,Hyperloop Viability: Vision versus Economics,"Search for quotes on hyperloop projects, focusing on visionary potential (e.g., high-speed travel) versus economic challenges (e.g., funding, scalability). Prioritize transport economics, hyperloop plans, and fiction on futuristic transport.",,,,6/9/26,,xynapse_traces,Nimble Books LLC,paperback,,
Artificial Intelligence,Scientific AI: Breakthrough versus Increment,"Seek quotes on scientific AI, exploring breakthrough discoveries (e.g., new theories) versus incremental progress (e.g., refined models). Include scientific computing papers, AI goals, and sci-fi on AI-driven science.",,,,6/16/26,,xynapse_traces,Nimble Books LLC,paperback,,
Government Efficiency,Service Automation: Speed versus Humanity,"Find quotes on AI-driven public service automation, weighing speed (e.g., efficient delivery) versus human elements (e.g., empathy, judgment). Focus on public service studies, automation comments, and fiction on automated services.",,,,6/23/26,,xynapse_traces,Nimble Books LLC,paperback,,
Collective Knowledge,Online Discourse: Diversity versus Polarization,"Collect quotes on discourse platforms, exploring diverse engagement (e.g., global voices) versus polarization risks (e.g., echo chambers). Prioritize discourse analysis, platform posts, and fiction on online communities.",,,,6/30/26,,xynapse_traces,Nimble Books LLC,paperback,,
Pronatal Innovation,Population Growth: Ethics versus Urgency,"Search for quotes on AI-driven pronatalism, focusing on ethical growth strategies (e.g., voluntary incentives) versus urgent pressures (e.g., demographic decline). Include ethics studies, pronatal views, and fiction on population ethics.",,,,7/7/26,,xynapse_traces,Nimble Books LLC,paperback,,
Resilience and Vision,Setback Recovery: Resilience versus Defeat,"Seek quotes on recovery from failures, exploring resilience (e.g., project recoveries) versus risks of defeat (e.g., financial strain). Focus on resilience psychology, failure narratives, and fiction on overcoming setbacks.",,,,7/14/26,,xynapse_traces,Nimble Books LLC,paperback,,
Technological Disruption,Tech Ethics: Progress versus Duty,"Find quotes on technological advancements, weighing progress (e.g., innovation leaps) against ethical duties (e.g., societal impact). Include tech ethics studies, expert comments, and fiction on technological responsibility.",,,,7/21/26,,xynapse_traces,Nimble Books LLC,paperback,,
Space Economy,Space Tourism: Opportunity versus Elitism,"Collect quotes on space tourism, exploring opportunities (e.g., public access) versus elitist barriers (e.g., high costs). Prioritize tourism economics, space tourism plans, and sci-fi on space travel.",,,,7/28/26,,xynapse_traces,Nimble Books LLC,paperback,,
Interplanetary Ambition,Advanced Propulsion: Speed versus Safety,"Search for quotes on next-generation space propulsion (e.g., nuclear, plasma drives), focusing on speed benefits (e.g., faster missions) versus safety concerns (e.g., radiation risks). Include propulsion physics papers, space R&D, and sci-fi on interstellar travel.",,,,8/4/26,,xynapse_traces,Nimble Books LLC,paperback,,
Neural Augmentation,Brain Plasticity: Potential versus Limits,"Seek quotes on neuroplasticity applications, exploring cognitive potential (e.g., learning enhancements) versus biological limits (e.g., neural capacity). Prioritize neuroscience studies, expert comments, and sci-fi on brain adaptability.",,,,8/11/26,,xynapse_traces,Nimble Books LLC,paperback,,
Sustainable Energy,Grid Modernization: Central versus Distributed,"Find quotes on grid upgrades, weighing centralized systems (e.g., large-scale grids) versus distributed models (e.g., microgrids). Focus on grid engineering studies, grid plans, and fiction on energy infrastructure.",,,,8/18/26,,xynapse_traces,Nimble Books LLC,paperback,,
Global Connectivity,Satellite Privacy: Access versus Surveillance,"Collect quotes on satellite privacy implications, exploring access benefits (e.g., global connectivity) versus surveillance risks (e.g., data tracking). Include privacy studies, satellite comments, and fiction on digital surveillance.",,,,8/25/26,,xynapse_traces,Nimble Books LLC,paperback,,
Urban Infrastructure,Tunnel Ecology: Sustainability versus Disruption,"Search for quotes on tunneling, focusing on sustainable benefits (e.g., reduced surface impact) versus ecological disruptions (e.g., construction impacts). Prioritize environmental engineering, tunneling plans, and fiction on urban ecology.",,,,9/1/26,,xynapse_traces,Nimble Books LLC,paperback,,
Artificial Intelligence,AI Openness: Sharing versus Secrecy,"Seek quotes on AI development approaches, exploring open sharing (e.g., public algorithms) versus proprietary secrecy (e.g., competitive advantage). Include open-source AI studies, AI comments, and sci-fi on AI transparency.",,,,9/8/26,,xynapse_traces,Nimble Books LLC,paperback,,
Government Efficiency,Budget Optimization: Savings versus Services,"Find quotes on AI-driven budget cuts, weighing savings (e.g., reduced waste) versus service impacts (e.g., reduced access). Focus on fiscal policy studies, budget proposals, and fiction on public finance.",,,,9/15/26,,xynapse_traces,Nimble Books LLC,paperback,,
Collective Knowledge,Knowledge Equity: Access versus Elitism,"Collect quotes on knowledge democratization, exploring universal access (e.g., open platforms) versus elitist barriers (e.g., expertise gaps). Prioritize education policy studies, platform posts, and fiction on knowledge access.",,,,9/22/26,,xynapse_traces,Nimble Books LLC,paperback,,
Pronatal Innovation,Reproductive Equity: Access versus Cost,"Search for quotes on AI-driven reproductive technologies, focusing on equitable access (e.g., affordable fertility tools) versus cost barriers (e.g., high-tech expenses). Include health equity studies, pronatal views, and fiction on reproductive access.",,,,9/29/26,,xynapse_traces,Nimble Books LLC,paperback,,
Resilience and Vision,Ethical Ambition: Vision versus Responsibility,"Seek quotes on ambitious goals, exploring visionary innovation (e.g., space, AI) versus ethical responsibilities (e.g., societal impacts). Focus on ethics studies, leadership interviews, and fiction on visionary ethics.",,,,10/6/26,,xynapse_traces,Nimble Books LLC,paperback,,
Technological Disruption,Economic Shifts: Growth versus Loss,"Find quotes on economic disruptions, weighing growth (e.g., new industries) versus losses (e.g., job displacement). Include labor economics, expert comments, and fiction on economic transformation.",,,,10/13/26,,xynapse_traces,Nimble Books LLC,paperback,,
Space Economy,Resource Extraction: Wealth versus Ethics,"Collect quotes on space resource extraction (e.g., asteroid mining), exploring wealth creation (e.g., economic growth) versus ethical concerns (e.g., space environment). Prioritize space economics, space plans, and sci-fi on resource mining.",,,,10/20/26,,xynapse_traces,Nimble Books LLC,paperback,,
Interplanetary Ambition,Martian Markets: Independence versus Subsidy,"Search for quotes on Martian economic systems, focusing on independent markets (e.g., local trade) versus Earth subsidies (e.g., financial support). Include economic modeling papers, space economic views, and sci-fi on Martian economies.",,,,10/27/26,,xynapse_traces,Nimble Books LLC,paperback,,
Neural Augmentation,Memory Enhancement: Accuracy versus Alteration,"Seek quotes on memory augmentation, exploring accurate recall (e.g., therapeutic uses) versus alteration risks (e.g., false memories). Prioritize cognitive science studies, expert comments, and sci-fi on memory manipulation.",,,,11/3/26,,xynapse_traces,Nimble Books LLC,paperback,,
Sustainable Energy,Net-Zero Goals: Realism versus Idealism,"Find quotes on net-zero ambitions, weighing realistic timelines (e.g., achievable reductions) versus idealistic goals (e.g., full decarbonization). Focus on climate policy studies, sustainability plans, and eco-fiction on climate targets.",,,,11/10/26,,xynapse_traces,Nimble Books LLC,paperback,,
Global Connectivity,Connectivity Economics: Affordability versus Profit,"Collect quotes on satellite internet economic models, exploring affordable access (e.g., low-cost plans) versus profitability (e.g., infrastructure costs). Include telecom economics, pricing strategies, and fiction on connectivity economics.",,,,11/17/26,,xynapse_traces,Nimble Books LLC,paperback,,
Urban Infrastructure,High-Speed Tunnels: Innovation versus Risk,"Search for quotes on high-speed tunnels, focusing on innovative transport (e.g., hyperloop speed) versus risks (e.g., safety, costs). Prioritize transport engineering, tunnel plans, and fiction on high-speed travel.",,,,11/24/26,,xynapse_traces,Nimble Books LLC,paperback,,
Artificial Intelligence,Medical AI: Healing versus Enhancement,"Seek quotes on medical AI applications, exploring healing (e.g., diagnostics, treatments) versus elective enhancements (e.g., cognitive boosts). Include medical AI studies, health goals, and sci-fi on medical technology.",,,,12/1/26,,xynapse_traces,Nimble Books LLC,paperback,,
Government Efficiency,Regulatory Streamlining: Freedom versus Safety,"Find quotes on AI-driven regulatory reforms, weighing freedom for innovation (e.g., reduced rules) versus safety protections (e.g., public welfare). Focus on regulatory studies, reform comments, and fiction on deregulation.",,,,12/8/26,,xynapse_traces,Nimble Books LLC,paperback,,
Collective Knowledge,Platform Integrity: Trust versus Manipulation,"Collect quotes on platform integrity, exploring trust-building (e.g., transparent algorithms) versus manipulation risks (e.g., biased content). Prioritize platform studies, platform posts, and fiction on digital trust.",,,,12/15/26,,xynapse_traces,Nimble Books LLC,paperback,,
Pronatal Innovation,Population Health: Optimization versus Tradition,"Search for quotes on AI-driven population health, focusing on optimization (e.g., genetic health, longevity) versus traditional approaches (e.g., natural wellness). Include public health studies, pronatal views, and fiction on human health.",,,,12/22/26,,xynapse_traces,Nimble Books LLC,paperback,,