id,title,subtitle,author,isbn13,series_name,series_number,page_count,publication_date,imprint,back_cover_text,storefront_publishers_note_en,front_cover_image_path,full_spread_pdf_path,interior_pdf_path
206ba05682b4,Birth Rate Boost: Policy versus Freedom,,AI Lab for Book-Lovers,,,,216,7/9/25,xynapse traces,"Embark on an illuminating journey through {stream} with '{title}'. This compelling book explores {description}, offering unparalleled insights into its core concepts. Inside, discover {quotes_per_book} meticulously curated quotations, providing direct access to the wisdom of brilliant minds. For true academic rigor, a comprehensive bibliography and a detailed verification log are included. Unlock a deeper understanding of our world.","In an age grappling with AI-driven futures and societal shifts, the debate over birth rates, policy, and personal freedom is paramount. This unique collection of high-quality, thought-provoking quotes offers a crucial lens into these complex issues, from pronatal strategies to individual choice. More than just reading, this book invites you to embrace 'pilsa,' the Korean art of transcriptive meditation. As you meticulously copy each powerful passage, you'll cultivate mindfulness, deepen your understanding, and forge a profound personal connection to these pressing questions. Engage with our collective destiny, one reflective stroke at a time, for clarity in uncertain times.",output/pilsa_build/covers/Birth_Rate_Boost_Policy_versus_Freedom_front_cover.png,output/pilsa_build/covers/Birth_Rate_Boost_Policy_versus_Freedom_cover_spread.pdf,
f409ce140f6c,Free Speech Platforms: Openness versus Regulation,,AI Lab for Book-Lovers,,,,216,7/9/25,xynapse traces,"Dive into the fascinating world of {stream} with '{title}', an essential exploration of {description}. This compelling volume unearths profound insights and unique perspectives, making complex ideas accessible and engaging. Featuring {quotes_per_book} meticulously selected quotations, a comprehensive bibliography, and a transparent verification log, this book is an indispensable resource for anyone seeking a deeper understanding. Discover the definitive guide to this captivating subject today.","In an age grappling with the complexities of digital discourse, 'Free Speech Platforms' offers a vital exploration of online openness versus regulation. This collection of profound quotes invites readers to engage deeply with critical perspectives on X Corp’s mission and the future of free speech. Through the ancient Korean practice of *pilsa*, or transcriptive meditation, you'll not only absorb these essential insights but also cultivate focus and clarity. This immersive method transforms passive reading into active reflection, allowing for a unique, personal journey into the nuanced debates shaping our digital world. Discover profound understanding and contribute to an informed dialogue on democracy's cutting edge.",output/pilsa_build/covers/Free_Speech_Platforms_Openness_versus_Regulation_front_cover.png,output/pilsa_build/covers/Free_Speech_Platforms_Openness_versus_Regulation_cover_spread.pdf,
d28bee23aa13,Global Renewables: Scale versus Scarcity,,AI Lab for Book-Lovers,,,,216,7/9/25,xynapse traces,"Unlock the profound insights of {stream} with *{title}*. This essential collection delves into {description}, offering a meticulously curated journey through thought-provoking wisdom. Featuring over {quotes_per_book} carefully selected quotations, this book is an invaluable resource for scholars and enthusiasts alike. It includes a comprehensive bibliography for further exploration and a transparent verification log, ensuring accuracy and reliability. Discover the enduring legacy of pivotal ideas within {stream}.","In an era defined by critical environmental choices, 'Global Renewables: Scale versus Scarcity' offers essential insights into humanity's most pressing energy dilemma. This curated collection of high-quality quotes invites deep engagement with the tension between scaling renewable energy and confronting resource limitations. More than reading, embrace *pilsa* – the Korean practice of transcriptive meditation. This mindful act transforms passive consumption into active reflection, allowing profound ideas to resonate and take root. By transcribing these thought-provoking passages, you'll gain clarity, foster personal wisdom, and contribute to understanding the complex path towards a sustainable future. Discover profound insights crucial for our time.",output/pilsa_build/covers/Global_Renewables_Scale_versus_Scarcity_front_cover.png,output/pilsa_build/covers/Global_Renewables_Scale_versus_Scarcity_cover_spread.pdf,
d9bf2deef61a,Industry Shifts: Innovation versus Instability,,AI Lab for Book-Lovers,,,,216,7/9/25,xynapse traces,"Dive into '{title}', a groundbreaking exploration in {stream}. This essential read unveils {description}. Featuring {quotes_per_book} meticulously verified quotations, this book provides unparalleled insight and clarity. A comprehensive bibliography supports its rigorous research, while a unique verification log ensures every claim is transparent and traceable. Discover the definitive resource in {stream} today.","In an era reshaped by unprecedented technological shifts, 'Industry Shifts' offers a vital space for reflection. This curated collection of high-quality, thought-provoking quotes on disruptive innovation, epitomized by figures like Elon Musk, invites a profound engagement. Through the ancient Korean practice of *pilsa*, or transcriptive meditation, you'll do more than just read; you'll internalize these critical discussions. Scribing each word fosters deeper contemplation on the delicate balance between progress and instability, job creation and displacement. This unique approach allows you to truly grasp today's industrial transformations, finding clarity and personal insight amidst the future's rapid unfolding.",output/pilsa_build/covers/Industry_Shifts_Innovation_versus_Instability_front_cover.png,output/pilsa_build/covers/Industry_Shifts_Innovation_versus_Instability_cover_spread.pdf,
f92a56e069e7,Internet for All: Inclusion versus Barriers,,AI Lab for Book-Lovers,,,,216,7/9/25,xynapse traces,"How do timeless philosophical questions resonate with cutting-edge cognitive science? '{title}' unveils the profound connections at the heart of {stream}. Bridging abstract thought with empirical understanding, this book explores consciousness, knowledge, and reality through a curated collection of insights. Featuring {quotes_per_book} impactful quotations, a comprehensive bibliography, and a meticulous verification log, it offers a rigorous yet accessible journey into the human mind. Explore the convergence of wisdom and science.","Dive into ""Internet for All: Inclusion versus Barriers,"" a unique collection of quotes exploring Starlink's global mission and the digital divide. Engage deeply with these profound insights through *pilsa*, the Korean practice of transcriptive meditation. This mindful act of copying not only enhances comprehension but fosters personal reflection on critical issues like affordability and access. In an era where digital equity is paramount, this book offers a unique path to understanding and contemplating the future of connectivity. Discover new perspectives and empower your thoughts on this vital contemporary challenge, transforming passive reading into active engagement.",output/pilsa_build/covers/Internet_for_All_Inclusion_versus_Barriers_front_cover.png,output/pilsa_build/covers/Internet_for_All_Inclusion_versus_Barriers_cover_spread.pdf,
4fa6aabf7633,Martian Commerce: Local versus Interplanetary,,AI Lab for Book-Lovers,,,,216,7/9/25,xynapse traces,"Dive into '{title}', a profound journey through {stream}. This captivating book {description}. Featuring {quotes_per_book} carefully selected quotations, a comprehensive bibliography, and a meticulous verification log, '{title}' is an indispensable resource for anyone seeking deeper understanding. Embark on this intellectual adventure today.","Beyond mere reading, immerse yourself in *Martian Commerce: Local versus Interplanetary* through the mindful Korean practice of 'pilsa,' or transcriptive meditation. This curated collection of high-quality, thought-provoking quotes on building economies from Mars' surface to Earth-Mars trade routes becomes a powerful tool for reflection. By physically transcribing these insights, you'll deepen your understanding of future economic models—from resource-based local markets to interplanetary commerce—and cultivate the critical foresight vital for navigating humanity's next frontier. Engage today for a richer tomorrow.",output/pilsa_build/covers/Martian_Commerce_Local_versus_Interplanetary_front_cover.png,output/pilsa_build/covers/Martian_Commerce_Local_versus_Interplanetary_cover_spread.pdf,
ff662ab08b19,Martian Self-Reliance: Isolation versus Earth Support,,AI Lab for Book-Lovers,,,,216,7/9/25,xynapse traces,,"Embark on a profound journey with 'Martian Self-Reliance,' a curated collection of quotes pondering humanity's future beyond Earth. In an era questioning our interconnectedness, this book invites you to explore critical dilemmas of independence versus support, using the ancient Korean practice of *pilsa*, or transcriptive meditation. As you hand-copy these powerful insights – from Musk's vision to astrobiological wisdom and sci-fi resilience – you'll not only deepen your understanding of space colonization but also cultivate focus and clarity. Discover profound relevance for our terrestrial challenges, finding wisdom for today in tomorrow's Martian dream. Engage, reflect, and transcribe your way to new perspectives.",output/pilsa_build/covers/Martian_Self-Reliance_Isolation_versus_Earth_Support_front_cover.png,output/pilsa_build/covers/Martian_Self-Reliance_Isolation_versus_Earth_Support_cover_spread.pdf,
a2857e45a365,Mind-Machine Fusion: Liberation versus Dependency,,AI Lab for Book-Lovers,,,,216,7/9/25,xynapse traces,"Dive into '{title}', a crucial exploration within the '{stream}' stream. This essential book illuminates {description}, offering profound insights for navigating complex challenges. Featuring {quotes_per_book} carefully selected quotations, it provides an unparalleled depth of understanding. A comprehensive bibliography and a transparent verification log ensure the utmost accuracy and reliability. Equip yourself with the foundational knowledge to shape a more informed future.","Explore the pivotal debate shaping our future: mind-machine fusion. This curated collection of quotes delves into Neuralink's promise of cognitive liberation versus the risks of dependency. Engage deeply with these thought-provoking insights through *pilsa*, the profound Korean practice of transcriptive meditation. By transcribing each passage, you'll foster unparalleled focus, mental clarity, and a deeper understanding of humanity's technological trajectory. In an era where our very minds are at the frontier of innovation, this book offers an indispensable guide for mindful reflection and informed contemplation on the future of human consciousness.",output/pilsa_build/covers/Mind-Machine_Fusion_Liberation_versus_Dependency_front_cover.png,output/pilsa_build/covers/Mind-Machine_Fusion_Liberation_versus_Dependency_cover_spread.pdf,
69d00092b78a,Streamlined Governance: Agility versus Oversight,,AI Lab for Book-Lovers,,,,216,7/9/25,xynapse traces,"{title} delves into the fascinating world of {stream}, bringing to life {description}. This captivating book reveals the insights and wisdom woven through its pages. Perfect for both experts and curious minds, it offers a rich exploration of its subject matter. Inside, you'll discover {quotes_per_book} meticulously curated quotations, a comprehensive bibliography for further study, and a unique verification log ensuring accuracy. Embark on a journey of discovery and deepen your understanding today.","In an era grappling with AI's impact on governance, this collection delves into the vital balance between agile, AI-driven reform and essential oversight. Through the mindful Korean practice of *pilsa* – transcriptive meditation – you are invited not just to read, but to truly *engage* with these high-quality, thought-provoking quotes. The act of copying fosters deeper reflection, clarity, and personal insight into complex challenges like accountability and fairness in public administration. This unique approach makes critical contemporary discourse personally resonant, offering a powerful tool for understanding and shaping our future.",output/pilsa_build/covers/Streamlined_Governance_Agility_versus_Oversight_front_cover.png,output/pilsa_build/covers/Streamlined_Governance_Agility_versus_Oversight_cover_spread.pdf,
110cedf697ea,Subterranean Cities: Efficiency versus Feasibility,,AI Lab for Book-Lovers,,,,216,7/9/25,xynapse traces,"Uncover profound insights within '{title}', a captivating exploration into the '{stream}' field. Drawing on its initial description, this book offers: {description}. This essential read challenges conventional thinking and invites you on a journey of discovery, offering a fresh perspective on its subject matter. Inside, you'll find {quotes_per_book} carefully selected quotations, a comprehensive bibliography for further exploration, and a unique verification log ensuring scholarly rigor. Prepare to broaden your understanding and engage with the cutting edge of this fascinating domain.","In an era grappling with urban sprawl and congestion, *Subterranean Cities* presents a vital exploration into our future metropolises. This collection of thought-provoking quotes, delving into Musk’s tunneling ambitions and urban engineering’s efficiency-feasibility dilemma, invites more than casual reading. Through the Korean practice of 'pilsa'—transcriptive meditation—you'll engage deeply, transforming passive consumption into active, mindful reflection. This deliberate act of transcribing fosters clarity, reduces mental noise, and allows profound insights into the challenges and opportunities of reimagining our cities. Discover the quiet power of the pen to unlock deeper understanding, finding personal calm amidst the complexities of tomorrow’s urban landscape.",output/pilsa_build/covers/Subterranean_Cities_Efficiency_versus_Feasibility_front_cover.png,output/pilsa_build/covers/Subterranean_Cities_Efficiency_versus_Feasibility_cover_spread.pdf,
72fdab5de0fe,Visionary Drive: Passion versus Peril,,AI Lab for Book-Lovers,,,,216,7/9/25,xynapse traces,"{title} offers a profound exploration into {description}. This captivating book navigates the complexities of {stream}, providing deep insights and challenging conventional wisdom. Discover new perspectives and enrich your understanding. Featuring {quotes_per_book} carefully selected quotations, a comprehensive bibliography for further exploration, and a transparent verification log, {title} is an indispensable resource for anyone eager to delve deeper. Uncover the wisdom within its pages.","In an era of unprecedented ambition, 'Visionary Drive' offers profound insights into the human cost of relentless pursuit. Engage deeply with thought-provoking quotes exploring passion's highs and leadership's perils through the ancient Korean practice of *pilsa*. Transcriptive meditation transforms reading into a mindful journey, allowing you to absorb wisdom and reflect on the intricate balance between innovation and its personal toll. This unique, deliberate engagement fosters self-awareness and resilience, making this collection an indispensable guide for anyone navigating their own aspirations in our complex world. Discover clarity, cultivate understanding, and chart your course with renewed purpose.",output/pilsa_build/covers/Visionary_Drive_Passion_versus_Peril_front_cover.png,output/pilsa_build/covers/Visionary_Drive_Passion_versus_Peril_cover_spread.pdf,
123,Martian Self-Reliance: Isolation versus Earth Support,,AI Lab for Book-Lovers,,,,216,7/10/25,xynapse traces,"Dive into {title}, a groundbreaking {stream} book that {description}. This essential volume offers profound insights and clarity on complex topics. Featuring {quotes_per_book} meticulously curated quotations, it provides an authentic and engaging reading experience. Complete with a comprehensive bibliography and a unique verification log, this is an indispensable guide for scholars and enthusiasts alike.","Embark on a profound journey with 'Martian Self-Reliance,' a curated collection exploring humanity's ultimate challenge: thriving autonomously far from Earth. This isn't just reading; it's an invitation to engage deeply through the Korean practice of *pilsa*, or transcriptive meditation. As you meticulously copy these insightful quotes on isolation, interdependence, and resilience, you'll uncover new perspectives on resourcefulness, governance, and what it truly means to build a future. In an increasingly complex world, the dilemmas of Mars offer vital metaphors for our own self-reliance and interconnectedness, making this an essential guide for thoughtful exploration.",,,,Martian Self-Reliance: Isolation versus Earth Support,,AI Lab for Book-Lovers,,,,216,2025-07-10,xynapse traces,"Dive into '{title}', a vital exploration within the '{stream}' field. Drawing on its initial description: {description}, this book offers profound insights and fresh perspectives. Featuring {quotes_per_book} meticulously selected quotations, a comprehensive bibliography, and a unique verification log, '{title}' stands as a rigorous and essential resource for anyone seeking a deeper understanding. Uncover compelling knowledge with scholarly precision.","In an era where self-reliance and global interdependence are critically examined, 'Martian Self-Reliance' offers a timely exploration. This unique collection distills profound insights into establishing a Mars colony – balancing isolationist innovation with Earth's essential support. From visionary space plans to speculative fiction, these high-quality quotes invite deep reflection. Engage with them through 'pilsa,' the Korean practice of transcriptive meditation. This mindful act of transcribing transforms passive reading into active contemplation, fostering clarity and resilience. Discover how the challenges of Mars illuminate our own vital questions about community, resources, and our future.",output/pilsa_build/covers/Martian_Self-Reliance_Isolation_versus_Earth_Support_front_cover.png,output/pilsa_build/covers/Martian_Self-Reliance_Isolation_versus_Earth_Support_cover_spread.pdf,
,AI Precision: Accuracy versus Error,,AI Lab for Book-Lovers,,,,216,2025-07-10,xynapse traces,"Dive into {title}, a meticulously curated collection exploring the heart of {stream}. Drawing from the insightful perspectives highlighted in its initial description, this book offers a profound journey into its core themes. Featuring {quotes_per_book} thought-provoking quotations, it’s an indispensable resource for enthusiasts and scholars alike. Every quote is meticulously verified, complete with a comprehensive bibliography and a transparent verification log. Uncover wisdom and clarity within these pages.","In an era increasingly shaped by Artificial Intelligence, understanding its nuances—from xAI's precision to inherent risks—is paramount. This collection of curated, high-quality quotes invites you to a profound engagement through 'pilsa,' the Korean practice of transcriptive meditation. As you meticulously transcribe each thought-provoking passage, you'll not only deepen your comprehension and retention but also cultivate a mindful awareness of AI's critical role in our world. This unique practice transforms reading into an active, contemplative journey, fostering clarity and insight essential for navigating the complex future of AI with informed discernment.",output/pilsa_build/covers/AI_Precision_Accuracy_versus_Error_front_cover.png,output/pilsa_build/covers/AI_Precision_Accuracy_versus_Error_cover_spread.pdf,
,AI-Driven Science: Speed versus Safety,,AI Lab for Book-Lovers,,,,216,2025-07-10,xynapse traces,,"In an era defined by AI's breathtaking acceleration, understanding its profound impact on science is paramount. This unique collection, 'AI-Driven Science: Speed versus Safety,' invites you to explore the exhilarating potential and critical ethical dilemmas through curated quotes. Engaging with these powerful insights via the Korean practice of 'pilsa,' or transcriptive meditation, offers a singular opportunity. As you meticulously transcribe each thought-provoking passage, you'll foster deeper comprehension, mindful reflection, and a personal connection to this urgent conversation. Discover clarity amidst complexity, shaping your perspective on humanity's most transformative technological frontier.",output/pilsa_build/covers/AI-Driven_Science_Speed_versus_Safety_front_cover.png,output/pilsa_build/covers/AI-Driven_Science_Speed_versus_Safety_cover_spread.pdf,
,Battery Revolution: Innovation versus Constraints,,AI Lab for Book-Lovers,,,,216,2025-07-10,xynapse traces,"Dive into the captivating world of {stream} with ""{title}""! This compelling book delves into {description}, offering an unparalleled exploration of its nuances. Uncover profound insights and historical context, guided by {quotes_per_book} illuminating quotations that bring the subject to life. Complete with a comprehensive bibliography and a transparent verification log, this volume is an essential resource for enthusiasts and scholars alike. Expand your understanding today.","Dive into 'Battery Revolution,' a compelling collection exploring Tesla's pivotal battery innovations against formidable constraints like supply and cost. In an age where energy solutions shape our future, this book offers profound insights. Engage deeply with each thought-provoking quote through *pilsa*, the Korean practice of transcriptive meditation. This unique method fosters active reflection, allowing you to internalize complex ideas from materials science to Musk's bold visions. Discover not just the facts, but the nuances of a revolution unfolding, making this an indispensable guide for understanding today's most crucial technological frontier.",output/pilsa_build/covers/Battery_Revolution_Innovation_versus_Constraints_front_cover.png,output/pilsa_build/covers/Battery_Revolution_Innovation_versus_Constraints_cover_spread.pdf,
,Birth Rate Boost: Policy versus Freedom,,AI Lab for Book-Lovers,,,,216,2025-07-10,xynapse traces,"Unlock the secrets of '{title},' a groundbreaking journey through {stream}. This book confronts the profound questions arising from {description_summary}, challenging your view of consciousness and reality. Discover understanding by embracing the unknown. Featuring {quotes_per_book} insightful quotations, a comprehensive bibliography, and a transparent verification log, this essential volume illuminates deeper truths. Challenge your perceptions. Your intellectual odyssey begins now.","In an age grappling with demographic shifts and AI's influence on society, 'Birth Rate Boost: Policy versus Freedom' offers a timely exploration. This collection of high-quality, thought-provoking quotes invites you to engage deeply through *pilsa*—the Korean practice of transcriptive meditation. Physically transcribing these insights fosters mindful reflection, allowing you to absorb complex ideas, clarify your own stance on critical issues like pronatal policies versus individual liberties, and find personal wisdom. This isn't just reading; it's a profound, deliberate journey into humanity's future, relevant and vital for navigating today's complex world.",output/pilsa_build/covers/Birth_Rate_Boost_Policy_versus_Freedom_front_cover.png,output/pilsa_build/covers/Birth_Rate_Boost_Policy_versus_Freedom_cover_spread.pdf,
,Bold Leadership: Inspiration versus Pressure,,AI Lab for Book-Lovers,,,,216,2025-07-10,xynapse traces,"Dive into '{title}', a profound journey through {stream}. This book offers a deep exploration of {description}. Featuring {quotes_per_book} meticulously selected quotations that illuminate key concepts, this indispensable guide also includes a comprehensive bibliography for further exploration and a transparent verification log, ensuring scholarly rigor. Discover new perspectives on the subject.","In an era demanding transformative leadership, 'Bold Leadership' offers profound insights into navigating the delicate balance between inspiring vision and intense pressure, epitomized by figures like Elon Musk. This unique collection of thought-provoking quotes invites you to engage with these powerful ideas through 'pilsa,' the Korean practice of transcriptive meditation. By mindfully hand-copying these words, you'll not only internalize complex leadership psychology but also cultivate focus, resilience, and a deeper understanding of your own path. Discover how to harness inspiration, manage pressure, and lead with purpose in today's dynamic world.",output/pilsa_build/covers/Bold_Leadership_Inspiration_versus_Pressure_front_cover.png,output/pilsa_build/covers/Bold_Leadership_Inspiration_versus_Pressure_cover_spread.pdf,
