imprint_concept,additional_info,target_audience
"A boutique literary press focused on contemporary fiction by emerging authors, emphasizing diverse voices and experimental narratives","Specializes in debut novels and short story collections","Literary fiction readers aged 25-45"
"An academic imprint dedicated to publishing cutting-edge research in artificial intelligence and machine learning","Focus on peer-reviewed research and textbooks","Researchers, graduate students, and AI professionals"
"A children's book imprint that creates interactive and educational content for early readers","Emphasis on STEM education and diversity","Parents, teachers, and children ages 4-8"
"A poetry imprint celebrating contemporary voices and traditional forms","Quarterly chapbook series and annual anthology","Poetry enthusiasts and literary community"
"A business book imprint focused on entrepreneurship and startup culture","Practical guides and case studies","Entrepreneurs, business students, and professionals"